venue_id,name,short_name,address,suburb,latitude,longitude,default_radius_km,event_context,status,access_notes,public_transport_notes,parking_notes,source_url
suncorp_stadium,Suncorp Stadium,Suncorp,"40 Castlemaine Street, Milton QLD 4064",Milton,-27.464800,153.009500,1.0,major stadium event exit flow,active,"Use surrounding streets rather than the immediate gate crowd where possible.","Milton station and nearby bus stops support event movement.","Event parking and road controls vary by event.",""
queensland_tennis_centre,Queensland Tennis Centre,QTC,"190 King Arthur Terrace, Tennyson QLD 4105",Tennyson,-27.525518,153.007202,1.0,tennis event exit flow,active,"Primary venue access is via King Arthur Terrace, Softstone Street, or Fairfield Road. Avoid relying on internal car parks during major events.","Yeronga station is about 1 km away according to the venue website; venue FAQ also notes Yeerongpilly station is about 800 m away.","On-site parking is normally available but may be unavailable during major tournaments, so pickup guidance should prefer public street pickup zones.","https://www.queenslandtenniscentre.com.au/contact/find-us/"
chandler_sports_precinct,Chandler Sports Precinct,Chandler,"Sleeman Sports Complex, Old Cleveland Road, Chandler QLD 4155",Chandler,-27.511350,153.147600,1.2,multi-sport precinct event exit flow,active,"Large precinct with several internal facilities; pickup guidance should prefer public road edges on Old Cleveland Road and Tilley Road rather than internal event crowds.","Bus access serves the Sleeman Sports Complex area; event shuttles may vary by event.","Large on-site parking exists but may be controlled during major events, so external pickup options should be retained.","https://giica.au/venues/chandler-sports-precinct"
brisbane_showgrounds,Brisbane Showgrounds,Showgrounds,"600 Gregory Terrace, Bowen Hills QLD 4006",Bowen Hills,-27.450800,153.032400,1.0,showgrounds and arena event exit flow,active,"Dense inner-city venue with multiple gates; pickup guidance should use Bowen Hills, Fortitude Valley, and Spring Hill road edges depending on closures.","Exhibition station, Fortitude Valley station, Bowen Hills station and bus corridors support high event demand.","Parking is constrained during Ekka and major events; curbside pickup should avoid the immediate Gregory Terrace crowd pressure.","https://www.brisbaneshowgrounds.com.au/about/precinct/"
ballymore_stadium,Ballymore Stadium,Ballymore,"91 Clyde Road, Herston QLD 4006",Herston,-27.439800,153.016100,1.0,stadium event exit flow,active,"Residential and hospital-adjacent roads require careful pickup filtering; prioritise Clyde Road and controlled shuttle-access points over narrow local streets.","Bus access is available, with nearby Royal Brisbane and Women's Hospital transport connections.","Limited venue parking; event plans may use remote or shuttle parking, so driver access scoring is important.","https://www.austadiums.com/stadiums/ballymore"
brisbane_arena,Brisbane Arena,Brisbane Arena,"Roma Street precinct, Brisbane City QLD 4000",Brisbane City,-27.464300,153.018000,1.0,planned inner-city arena event exit flow,planned,"Future inner-city arena planning area near Roma Street; pickup guidance should account for CBD kerb controls, rail station access, and high pedestrian volumes.","Roma Street station and CBD bus connections make this highly transit-rich, but ride pickup should avoid station frontage bottlenecks.","CBD parking and loading zones are highly managed; live road closure data will be important before final recommendations.","https://www.delivering2032.com.au/legacy-for-queensland/venues"
brisbane_aquatic_centre,Brisbane Aquatic Centre,Aquatic Centre,"Sleeman Sports Complex, Old Cleveland Road, Chandler QLD 4155",Chandler,-27.512045,153.148650,1.0,aquatic event exit flow,active,"Located inside Chandler Sports Precinct; pickup guidance should separate pool crowd exits from broader precinct traffic and prefer outer road pickup points.","Bus access serves the Chandler precinct, with event-specific transport arrangements likely for large meets.","On-site parking is available but event demand can be high; maintain fallback pickup points on surrounding roads.","https://giica.au/venues/brisbane-aquatic-centre"
